Title	Body	Comments	Post ID	Subreddit	Score	Upvote ratio	Date
Educational books for cis family members, including kids?	"Crossposting to /r/asktransgender and /r/TransyTalk 

So, I'm not attending my family's Christmas celebration this year due to several family members expressing discomfort with my refusal to present exclusively masculine.  I came out to them around this time last year and wore a nice dress to the gathering and everyone seemed fine with it then.  Over time it seems that the realization this isn't a phase is setting in, especially since I've started HRT, and since I've grown confident in wearing silicone breastforms a lot of the time.

I'd like to put together an educational package for them with a handful of books that will help my conservative Christian family understand what I'm going through, how to cope with the shattering of their world views, how to be a good ally, etc.  The target audience here would include adult cis males and females in their 30s and 60s, cis male and female children in early adolescence, and one cis female kid around 7-10.  

This package will also include a card explaining that I love them and want to be comfortable around them and want them to be comfortable around me, and that hopefully the contents of the package will be a start towards that goal.  My one sister so far has been very supportive and eager to learn and understand throughout all this, so I'll designate her to deliver the package.

Does anyone have any recommendations on books that would be good to include?  I'm looking on Amazon right now and see some that might fit the bill, but it would be nice to hear from anyone else who has given books to family members for a similar reason.

TL;DR:  Got any book recommendations for gifting to Christian conservative family members (adults and children) to broaden their understanding of gender?

**Update:**  I went ahead and ordered several copies of a bunch of books and PFLAG publications.  I'll be arranging them into 3 individual boxes for each household, with cash hidden in the pages.  These 3 boxes will be wrapped and then placed into a larger wrapped box filled with candy and other little gifts.  At the very top, first thing they see after opening the main box, will be an envelope with a label instructing to read before opening the other boxes.  The envelope will contain the card I mentioned before with my personal message/letter, and at the end of it I'll mention that there's X amount of cash per person hidden throughout the pages of the books.  That way they have to at least pick them up and flip through the pages, and maybe something will catch their eye even if they weren't planning to read any of it.

I ordered the following publications from the [PFLAG bookstore](https://bookstore.pflag.org/site/index.php):

* [Faith in Our Families](https://pflag.org/resource/faith-our-families)
* [Guide to Being a Trans Ally](https://pflag.org/publication/guidetobeingatransally)
* [Our Trans Loved Ones](https://pflag.org/ourtranslovedones)
* [Our Children](https://pflag.org/resource/our-children) (giving this one just to my parents)
* thanks to /u/Ficklepigeon for suggesting PFLAG publications

I've also ordered the following books from Amazon:

* [""They/Them/Their""](https://www.amazon.com/gp/product/1785924834) by Eris Young
 * thanks to /u/GhostWoodDweller for this recommendation
* [""Gender: Your Guide: A Gender-Friendly Primer on What to Know, What to Say, and What to Do in the New Gender Culture""](https://www.amazon.com/gp/product/1507210701) by Lee Airton, PhD
* [""A Quick & Easy Guide to They/Them Pronouns""](https://www.amazon.com/gp/product/1620104997) by Archie Bongiovanni and Tristan Jimerson
* [""A Quick & Easy Guide to Queer & Trans Identities""](https://www.amazon.com/gp/product/1620105861) by Mady G. and J.R. Zuckerberg"	"[deleted]
""They, Them, Their"" by Eris Young. For adults. It talks about what nonbinary means and why it's important to be acknowledged and accepted. It's a little dense like...essay style but was valuable to have my mom read it.
Also consider asking on r/transbooks, maybe someone has more to add.
**Update:**  I went ahead and ordered several copies of a bunch of books and PFLAG publications.  I'll be arranging them into 3 individual boxes for each household, with cash hidden in the pages.  These 3 boxes will be wrapped and then placed into a larger wrapped box filled with candy and other little gifts.  At the very top, first thing they see after opening the main box, will be an envelope with a label instructing to read before opening the other boxes.  The envelope will contain the card I mentioned before with my personal message/letter, and at the end of it I'll mention that there's X amount of cash per person hidden throughout the pages of the books.  That way they have to at least pick them up and flip through the pages, and maybe something will catch their eye even if they weren't planning to read any of it.

I ordered the following publications from the [PFLAG bookstore](https://bookstore.pflag.org/site/index.php):

* [Faith in Our Families](https://pflag.org/resource/faith-our-families)
* [Guide to Being a Trans Ally](https://pflag.org/publication/guidetobeingatransally)
* [Our Trans Loved Ones](https://pflag.org/ourtranslovedones)
* [Our Children](https://pflag.org/resource/our-children) (giving this one just to my parents)
* thanks to /u/Ficklepigeon for suggesting PFLAG publications

I've also ordered the following books from Amazon:

* [""They/Them/Their""](https://www.amazon.com/gp/product/1785924834) by Eris Young
 * thanks to /u/GhostWoodDweller for this recommendation
* [""Gender: Your Guide: A Gender-Friendly Primer on What to Know, What to Say, and What to Do in the New Gender Culture""](https://www.amazon.com/gp/product/1507210701) by Lee Airton, PhD
* [""A Quick & Easy Guide to They/Them Pronouns""](https://www.amazon.com/gp/product/1620104997) by Archie Bongiovanni and Tristan Jimerson
* [""A Quick & Easy Guide to Queer & Trans Identities""](https://www.amazon.com/gp/product/1620105861) by Mady G. and J.R. Zuckerberg
I'm a bot, *bleep*, *bloop*. Someone has linked to this thread from another place on reddit:

- [/r/asktransgender] [Educational books for cis family members, including kids?](https://www.reddit.com/r/asktransgender/comments/e8fx5w/educational_books_for_cis_family_members/)

- [/r/transbooks] [Educational books for cis family members, including kids?](https://www.reddit.com/r/transbooks/comments/e8u3d5/educational_books_for_cis_family_members/)

&nbsp;*^(If you follow any of the above links, please respect the rules of reddit and don't vote in the other threads.) ^\([Info](/r/TotesMessenger) ^/ ^[Contact](/message/compose?to=/r/TotesMessenger))*
Thanks, I didn't really know about PFLAG before; I love that this org exists and has literature available!
Thanks for the suggestion and also indicating what segment of my audience it might be good for.  I'll check it out! :)
Excellent idea; done!"	e8frsu	NonBinary	6	1.0	2019-12-09 20:47:04
PA Governor signs bill banning conversion therapy			wqnuxo	NonBinary	4	0.76	2022-08-17 12:35:06
Anyone else find it hard to come out, even when you know the person will be accepting of you?	"My partner is enby, and they've told me in the past that they don't care what my gender is and that they love me for me. I know *for a fact* that they will still want to be with me when I tell them, but why is it so hard to just tell them? My partner is the most accepting person I've ever met, and we're together for the long haul.

My partner coming out to me actually kind of kick started my realization that I might be non-binary too. Like, I wanted to understand what it's like after they came out to me, so I went online and started reading about it and watching videos by other enbies explaining how they knew they were enby. It was like ""Haha, that's kind of funny, I've experienced that feeling too... And that one... And that one... And that one... Ah shit.""

I don't know. Some days I feel more or less like a man. But then on other days, I don't really feel like anything. I know I'm not a trans woman, but I don't think I'm entirely a man either. A lot of the time, I just feel like a human consciousness crammed into a meat suit against my will that just happens to have a dick. I *want* my partner to know, but I can't find the words. I keep trying to tell them in person, but I always get too nervous. Not because I'm scared of how they'll react, but like saying it out loud makes it real. But at the same time, I want to come out in general. I want my partner to be the first person I tell, then I want to tell my friends (who I know also won't give a shit about my gender either), then I want to change my email signature at work to say ""he/they"" at the end. I want to paint my nails and wear skirts to work, but my parents would see when I pick up my dog after work, and they definitely aren't accepting. It is what it is though. I'm an adult. I don't live with them. I pay my own rent and my own bills. What can they do? Ground me?"	"[deleted]
Why won't you read or show this to your partner? This is perfectly understandable explanation of your situation. You don't have to be ""ready"" or fully figure out your gender when you talk about it to close and trusted people. Your gender already is as real as you are and your partner can support you to find the next steps in your process.
That's a good idea! My partner is really into makeup, so maybe I'll ask if they can do mine"	wlgr96	NonBinary	6	1.0	2022-08-11 03:08:07
Nervous about new job, gendering and all that nonsense	"(agender AFAB on HRT-T 12mos, they/it pronouns, 26y.o.

welp, i reenter the general public next tuesday. I quit my job at a bank a few months back to get my mental health right, and ive been living just going to school online and working just enough work study hours (generally just backroom filing work) to pay my bills and eat.

I start working graveyard at a local 7/11 tuesday night and Im... nervous, to say the least. I just passed my year anniversary on T and that sparked a little reminder I set that ""allowed"" me to really check my progress. Ive changed a LOT and I fucking LOVE IT.... so I really hate how nervous my ""obvious trans-ness"" makes me feel about interacting with the general public. I have facial hair now (which I love!), and my voice is still figuring itself out in a very PUBESCENT way.

I live in the Pacific NW, so it IS fairly liberal but I mean... we do be livin in a society :/ I already got prodded by my hiring manager; she was trying to be subtle about it, she might even say friendly, but... idk, the weird combo of odd phrasing, her tone, and the long pauses she would leave after I would answer her weird questions e.g. ""Oh, you have such a unique name, are there *other women* in your family with the name, or???""
and like, i leave my house often enough for groceries or whatnot to have still encountered more than a few people who's ""curious attention"" turns up a little more in aggressiveness or intensity.

I would very much like to be a constantly blurry figure in the vague shape of a humanoid. I would rather just be a physical manifestation of the concept ""midnight snack cravings"". I wish I was a tree.
I do not want to be referred to. F in the chat for my mental stability, Im gonna need it."	"F

Also,  same on that last paragraph
""just wanna be a cryptid"" solidarity U_U"	oy75ug	NonBinary	6	0.88	2021-08-05 01:26:30
Anyone have experience with getting non binary top surgery covered by insurance in New York?	"Hi all,

My insurance company (Empire Blue Cross) does cover transgender surgeries if your surgeon is in network.  Pre auth is required and must include why the surgery is medically necessary.  I guess there are many different ways you can deem this kind of surgery to be medically necessary.  New York state also mandates that insurance cover transgender surgeries.

Since I'm not FtM, I'm not sure how this is going to play out.  I've met with the surgeon about the procedure and his billing specialist who will call insurance once I get my letter from my therapist.  

I didn't know if anyone has had experience with this or has had top surgery covered by insurance being a transmasculine/gender nonconforming person.  Any insight/advice is appreciated."	"Im in NY and got mine covered by insurance. I never told the therapist I saw either way, not that I was nonbinary NOR that I was a binary guy. I just talked about gender dysphoria and how long I’ve been on T. She just wrote the letter as if I was binary; not sure if it was assumptions or what.  I do use he/him pronouns though.

 If you don’t want to do T and use they/them, I think it should be fine if you use an experienced therapist who can just specify your gender dysphoria diagnosis, social transition, and maybe not use pronouns for you. 

WPATH says people should be able to have top surgery to their target gender without hormones, so surgeons should be fine and hopefully insurance will be too. You can call your insurance and have them send you the specific part of your specific policy that covers gender affirming care and make sure your letter or letters hit all the required points. 
I have no insight, but I have blue choice option (the low-income version of blue Cross) and am curious about the same thing for down the road a bit. Thanks for asking, looking forward to reading responses.
My partner is still identifies as female (occasionally toys with non-binary), and is getting top surgery next month covered by insurance. She met with a therapist, who focused more on the gender dysphoria, that she has been binding for years and it was covered by Blue Cross.
She is not on T and uses she/her pronouns.
Her surgeon also had suggestions about what should be included in the letter. Since they deal with insurance all the time it's worth asking them.
Thank you!  That's what I'm hoping for too that if I cross all my T's in terms of documentation and really emphasis what the WPATH standards say, they should have no issues denying it.  My next plan is to call the pre-authorization line myself to ask basically what do you need and what should this letter say so it doesn't get denied?  Did you send anything else to insurance besides a letter from a therapist?  I don't have a primary care doctor and don't plan on using T.  I really appreciate your insight!
Hey there, I'm also looking forward to and hoping (fingers-crossed) that others share their experience.  It just gets so tricky navigating the mess that insurance can be.
Thanks for contributing to this post!  I am actually 5 weeks post op now :) - I'm hoping other NB/trans folk looking for surgery see this.  I also have Blue Cross and just needed to edit my letter.  Best of luck with her surgery!  It feels amazing!
You should not try to send your letter to your insurance or get pre-authorization yourself.  The surgeon you decide on will send in your letter and get the preauthorization.  The insurance company will want to get this from the providing doctor (surgeon) with appropriate codes and cost estimates.  My surgeon did this and it didn't take that long.  

You really should just try to get your insurance company to mail/email you your written policy.  The section on transgender coverage will specify, generally in great detail, what is required for coverage.  Getting this in written form is probably easiest.
I also have Empire BCBS and am wondering how you edited your letter? I don't want to be on HRT but I do want to be completely flat chested. I feel like I'm being put into a box I didn't ask to be in with all their requirements.
Thank you so much for the information!
I do want to add that this was almost over 4 years ago now and I'm sure the [WPATH](https://www.wpath.org/) Standards of Care have changed since then, and most likely for the better - meaning making it more easier and less rigid for those seeking trans-related healthcare.

At the time that I got top surgery,  I was not on T, had no plans to be on T was still sort of figuring out my gender and just knew that most of my dysphoria came from my chest.

The WPATH Standards of Care is what influences the policies and procedures that the insurance companies use to determine whether or not they'll cover hormones, top surgery, etc.  At the time, Empire BCBS was very specific with the language that needed to be in my letter from my therapist recommending me for top surgery.  Like for example, I think my therapist wrote I had been out as nonbinary for 2 years (I wasn't lol) I just said I was - but Empire BCBS needed it to specifically say I had been living in my preferred gender as non-binary/transmasculine for 2 years and needed a date I think.

So, there were a couple examples of the like above just about needing to tweak language for them to cover the surgery.  It was dumb and tedious - but easy to fix enough and my therapist was very much on board and editing it to make it say what it needed to.

As I was saying above, I think now things are a little more relaxed, especially to include nonbinary people so ideally there should be less obstacles for you.  You can usually google your insurance name and then top surgery to review the procedure/policy and what you would need exactly for them to approve it.  

\*Edited to add that it does also depend on what state you're in."	8bj80v	NonBinary	5	0.86	2018-04-11 18:09:32
Advice on how to come out to family?	"Hi everyone! I could really use some advice on some of the things I've been struggling with lately, namely finishing my transition with a name change!

I'm 23, afab, don't really label myself beyond 'queer' and I'm finally getting into the last stretches of my transition. Earlier this year I had my long awaited breast reduction, which was the only gender affirmation surgery I wanted. I still had to do it under the guise of being a cis woman with disproportionate and irregular chest size, but was lucky in that regard to have one breast be so much bigger than the other that I was eligible for it to be covered by insurance, although I'm still fighting them for them to actually cover my bill. Insurances, am I right?

So now the last thing that is left for me to do is to change my legal name to Luka, which is unisex in my language, so I can change it for the 'small' fee of only about 600€ without having to go through the tedious process of going to a gender clinic that then won't take me seriously because nonbinary identities are SO underrepresented here. Plus, I don't really have body dysphoria, so yeah... impossible. So unisex name and privately paid name change is the only way to go for me, and I'm happy with that.

Now to my real problem. My family is blissfully unaware of my gender, or my name change. They are fundamentalist Christians and would not understand my struggle with gender. I have managed to at least get them to acknowledge intersex bodies, but that's because they can't really argue against biological reality. I'm not worried about them kicking me out or anything, I moved out when I was 19 and am completely financially independent. BUT I have two sisters (12 and 9) who are very important to me. I know that after my name change, I will have to explain it to my family, but I don't know how to do it in a way that will make them accept my decision. I'm not even talking about coming out to them, I will not come out until my sisters are in their teens and able to make their own decisions about accepting me, without being brainwashed by my parents.

Amy advice on how to break the news of my name change to my family in a way that will not make them try and turn my siblings against me is very welcome!

Thank you all for reading!"	"A letter is a great opportunity for you to get everything you need to out in the open, and the recipient isn't on the spot trying to figure out how they feel about it and how to react to you. You can include things like:

- Talk about how they've said they'll always love you no matter what
- Frame it as telling them something wonderful you've learned about yourself that you want to share with them
- Describe who you are using simple terminology, defining any necessary terms
- Explain how you wish to be addressed
- Remind them that you're still the same person you always have been and you'll love them just like you always have
- Offer to provide additional information or answer questions, but avoid overwhelming them by including everything you can think of
Thanks! I'm not planning on coming out to them in regard to my gender, so I don't think there'll be much to explain or share there. I'm just unsure how to break the news that I 'rejected the name they gave me' and switched to the unisex version of the masc name they planned to give amab me.

I tested the waters already with my siblings and they seem very open to just switching what name they use, I'm just worried my parents will tell them that names are fixed or some other bs.

I haven't cared about a good relationship with my parents ever since I moved out beyond what is needed to keep in touch with my sisters until I can be open about my identity with them.

Besides, I already did the worst thing imaginable in my parents eyes, and that was leaving the church and being vocal about it."	nvdn31	NonBinary	5	0.86	2021-06-08 20:31:31
People being attacked for being lgbt	"https://www.gofundme.com/f/lgbtqi-refugees-of-kakuma-camp-in-kenya?utm_source=customer&utm_medium=copy_link_all&utm_campaign=p_cp+share-sheet

On r/lgbt I saw a post about this person who was attacked for being lgbt and literally had their eye ripped out and there was links to donate for their hospital bills I don’t have any money but I’m sharing the link so maybe someone who does c"		rt1zwu	NonBinary	4	0.75	2021-12-31 20:01:49
If you could shapeshift into any ONE thing, what would it be? Why and what would you do as that one thing?	Ill go first! I would choose to shapeshift into a Bill Cipher form. I wouldnt even want any crazy powers as long as i could float around and glow. I would honestly just sit in a dark room with nothing but myself as a light source for hours on end	"A dragon, because I wanna live for centuries, have a hoard of gold, be able to breathe fire, fly, and be covered in beautiful shining scales.

Or, how I see myself in my head, so (if all goes to plan), me in a few years after I get HRT
If it could only be one thing then I would pick a shapeshifting being that could shapeshift into anything 😊 haxx
I would keep my shapeshift in reserve and go on hormones for the next year. If I didn't like the result, I'd shapeshift back into my original pre-HRT form (maybe with a few cool extras like solid platinum tips to my fingernails and healthier lungs and joints). And if I wanted to keep the effects of HRT, I'd have in reserve the ability to heal from a mortal wound or reverse decades of my own aging for when I eventually needed one of those.
I would love to be a big winged panther. A cat who can fly, perfection!
Probably a wolf with wings. I like wolves, but I also think it'd be cool to fly.

If nonhuman entities are not an option, I'd choose to look how I envision myself in my head. So, muscular, AFAB, with no chesticles, lol. Short hair, too.
Being a giant frog would be sick, or the new ooze race in d&d that I can't remember the name of.
A fantasy owl with healing powers
Dragon. Shiny, fire-breathing, flying, and powerful. Also, completely genderless. Everyone loves dragons.
I'd morph into a creature that can shapeshift every day. Easy.
Logically speaking, I would turn into a very good looking girl ,Precisly My Best Friends Crush, then,i would go to his house late at midnight,i think you can guess where this is going...  
then when hes about to blow it, i turn back into myself and act like i dont know where i am and what is happening, Leaving him completely dumbfounded,and also kinda Gay.
Happy cake day!
Thanks"	xxg9f6	NonBinary	7	0.9	2022-10-06 21:03:42
I Think I Might Non-Binary?	I’m 16M (going on 17 in the next weeks). For the most part, my family (mostly women) would refer to me as the “man of the house” and as a “man”, I should pay bills, playing girls hearts, be manly, etc. Idk the terms “boy” or “man” never really sat right with me. I feel disgusted when I call myself a man or if I’m being compared with other boys about subjects (especially strength). I know that I’m not a girl nor a woman because I like my male parts. I’m kinda tired of it but my family is quite homophobic and transphobic. So yeah, idk if I’m non binary. I feel comfortable with he/him pronouns but I’m not comfortable being called a man, boy, girl, or woman. I’m just..me yk? Idk if that’s ok, or?	"That's a perfectly valid way to be. If you think that non-binary will adequately describe that experience, you're free to use it. It's up to you to decide if it's accurate or not.
Absolutely! For one thing, gender ≠ pronouns, but also... it sound's like you're in a situation where you don't really have the space to explore who you really are because of the pressures put on you to conform. Hopefully you'll have that opportunity soon to be able to hear your own voice, because whoever it is in there, they're worth it!
Why do you need to put a label on it? Why not just be you?"	tcufy6	NonBinary	5	0.78	2022-03-13 00:07:03
