Title	Body	Comments	Post ID	Subreddit	Score	Upvote ratio	Date
I did a thing!	"Hello!

So, not sure if this type of post is allowed here, but I wanted to share some personal accomplishment and good news! Feel free to start commenting something that you’ve accomplished as well! I want to hear all about your triumphs and your ambitions. Here’s mine:

After years of second guessing and deciding, I finally got accepted into college! I start this Summer for a Medical Billing and Coding Diploma! What this means is after the program, I will be certified and able to work in a hospital building setting in Insurance Follow Up/Medical Billing/Medical Coding or even a remote profession! I am beyond excited and I look forward to starting.

What’s even cooler is the college I applied for and got accepted by updated their markers and I was able to choose the Non-Binary option! They also asked pronouns. I know it doesn’t seem like a huge deal, but, I love that so many places are becoming more open and inclusive!

I hope everyone is having a good week and I can’t wait to hear what you’ve accomplished!"	"I have an appointment with a surgeon tomorrow to talk about getting a gender affirming hysterectomy!! Very excited!!!
Sounds wonderfull!!!
A couple months ago I got my fire fighter cirtificate, so I'm officially a fire figther, and I think thats pretty cool hahah!
Good luck with college!
Congratulations!!

I finally updated my chosen name at college so when I start they won't use my dead name 🤩
Huge congrats! 
I’m going back to school after dropping out 6 years ago. I’ve done a lot of growing since then and have come to realize that I’m much better suited to learning in a hands-on environment and would love to spend as much time as possible with plants ... so in 6 days I’ll be starting the first phase of apprenticeship in horticulture! 🙂
Congratulations! That’s awesome! 

 I am traveling in another country for the first time by myself with my X gender marker on my passport, and feeling really proud of my self. 😊
Nothing as big as y’all’s but this week I got one step closer to my euphoria feels with a haircut that’s buzzed short all around (a 2) except for the chin length hair left on top that can style masc or fem depending on what I’m feeling that day. I smile every time I see my haircut in the mirror now ❤️
congratulations!!
That’s awesome! Congrats!
congrats! i moved from the US to australia a few months ago for uni, and tomorrow i have my first appointment with my new endocrinologist :)
I’ll be sending positive, healing vibes your way!
That is amazing! I’m so proud of you! That’s a huge deal. Thank you and I will be sending you positive, successful vibes as you venture more into your career as a Fire Fighter.
Love it! That’s awesome!
Thank you!

I wish you all the best and best of luck as you return to school!
Aww! Yay! Thank you for your kindness! Stay safe.
Hey, that’s still a huge accomplishment. Rock it!
Thank you, sibling! ♥️
Thank you! ❤️"	124vjbh	NonBinary	48	1.0	2023-03-28 17:11:03
Call CA governor to support Gender Recognition Act signature (allows for nb marker)	"The California SB-179 bill, the Gender Recognition Act, has been sitting on the governor's desk for signature for three weeks and only has four days left to be signed into law.  This bill creates non-binary category for gender on birth certificates and driver's licenses. It also streamlines process for transgender, intersex and non-binary Californians to obtain identification documents. 

Please consider calling the Governor's office in support of SB-179,
The number is Governor Jerry Brown: 
(916) 445-2841

Here is a call script:
Hello, my name is __________, from _______________, California. I am calling to urge the governor to sign SB 179, the Gender Recognition Act. This act will increase the efficiency by which our transgender and non-binary citizens can obtain gender documents that are accurate. Also, our community members who do not identify with binary gender categories must be protected under state law. Making ""non-binary"" an officially recognized gender will enable thousands of Californians to carry identification that describes them as they identify themselves. It will send a powerful message that America's future must be one of inclusion and protection for gender and sexual minorities. Thank you!

source: https://www.indivisibleconejo.org/daily-actions/2017/10/6/daily-action-defend-transgender-rights-in-ca-dc"	"http://www.statescape.com/resources/legislative/bill-signing-deadlines.aspx'
If he does nothing or signs it then it will become law. if vetoed then it won't become law.
That’s good. It’s just kind of worrying that he hasn’t taken any action on it, so it could still go either way. 
well CA being on literal fire certainly doesn't help. "	75i4y0	NonBinary	40	0.99	2017-10-10 16:18:31
I was nervous about presenting more femme in public for the first time, but I'm super lucky to have a really supportive partner who is helping me out and has my back	"So i've been a little anxious this week because I've been planning on dressing a bit more femme for the first time in public this weekend. There's a protest against a 'Religious Discrimination' bill (basically the Australian Government trying to take us back to the good old days where you could fire/harass someone legally about their gender or sexuality) and I figured that would be a pretty safe space to try out some clothing and makeup around some non shitty peeps. 

It's been a little worrying to me because I'm unsure what sort of reaction I'd get from other people and most importantly my wife, who hasn't really seen me do much in the way changing my wardrobe yet, although she was really supportive about me when I came out to her as NB. But I had a super awesome night where I brought up that I might want to present a bit different and she wanted to see what I was thinking so we spent the whole night trying on clothes and she even helped me with my makeup, which I really needed since my result where pretty shaky from just youtube tutorials. 

I'm actually really looking forward to tomorrow now, and hopefully plenty of people show up and I'll try and get some photos if I can get a decent look going."	You have a great wife and I'm proud of you, that you opened yourself up to her!	etay91	NonBinary	42	1.0	2020-01-24 14:15:24
Gender X driver’s license option in Massachusetts (USA)	"The Massachusetts state Senate approved a bill to allow gender X markers on driver’s licenses. It now goes to the state House of Representatives. If approved, it would take effect in November. 

https://www.nytimes.com/aponline/2018/06/28/us/ap-us-drivers-licenses-gender-x.html

Bill: https://malegislature.gov/Bills/190/S2562

NY has a similar submitted state assembly bill that has not received a floor vote. Maine recently passed a similar bill. 

Call or contact your state legislators in support.

UPDATE: NJ has just passed bill that would allow self-affidavit of gender, including “non-binary/unspecified”, for birth certificates and their amendment."	"Yay!  I got my Oregon “gender x” drivers license one year ago today, and the same for my birth certificate in February.  Feels great!
I want this in Ohio!!
What would happen if someone with an X gender license later moved to a state without the option though?
I have used my non-binary DL many times at airport check-in and security.  I have yet to receive a single comment about it. 
Got a few years to go until my license renewal when all this SWHTF personally, but I'm wondering if CA's Gender Recognition Act & the Real ID Act will work together or not. All I have to prove identity is my certified U.S. birth certificate, so AMAB might be copied over to the Real ID... unless I have to escalate towards a federal lawsuit assuming nobody else has settled the issue of government not needing to know our stinkin' genders.

Real ID was passed over a decade ago, so you'd think CA would have had enough time to figure out if the non-binary DLs will be Real ID Compliant vs Federal Non-Compliant... 

If Real ID Act isn't agnostic on gender standard, I don't see it being amended by Congress to allow for non-binary licenses until at least 3/4 of the states are in on it.

https://transgenderlawcenter.org/archives/14062

https://www.dmv.ca.gov/portal/dmv/detail/realid
Have you used the DL all by itself in any Real ID Act situations?

My Google-fu is weak as to anyone being refused boarding planes, et al, with only ""gender x"" licenses; only finding the standard ""if government agents want to be totalitarian, can they?"" articles [narrator: they CAN keep getting away with it via various grants of immunity].

http://www.foxnews.com/politics/2017/07/07/will-new-gender-neutral-licenses-fly-with-tsa.html

https://www.judicialwatch.org/blog/2017/06/d-c-offers-gender-neutral-drivers-licenses-odds-federal-law/
They’d probably make you pick M or F and might maybe you  demonstrate  the validity of your choice with a birth certificate or medical professional’s letter.  Or you might have the basis for a lawsuit against the new state.
X gender markers are valid under the Real ID act. The act requires  that Real ID compliant driver’s licenses/IDs have a gender marker,  but it does not require that they be M or F. 
The Real ID Act requires that gender be included on the ID, but it does NOT specify what gender options are acceptable.  The right wing “Judicial Watch” article is blatantly lying. 
I don’t think this is a significant  concern, despite the scaremongering of very conservative groups.  Many states, including those with x marker options, have extensions to become compliant with the real ID act. If their gender marker options would make them non-compliant, they will be told before their extension is up. Also, TSA accepts passports from other countries with x markers on them and it is considered a legal marker by the main international body that sets passport standards.
So as usual, we're left at totalitarian/government agents' mercy if they say ""X isn't a gender [marker], you're not getting on that plane with just this DL"" etc. As the magic wand of immunity is waved over their every human rights violation.
No, they're pointing out what should be an obvious angle of attack so we (our competent lawyers) can prepare for the inevitable totalitarian fuckery. Even if you see Judicial Watch as your enemy, why interrupt them from making a mistake? [Strategy more.](https://www.brainyquote.com/quotes/napoleon_bonaparte_103585)

You have to think like a government lawyer: ""What soon-to-be-rubber-stamped POS totalitarian argument should I make in court to defend my client's fucking of human rights to death? I know! Male is a gender, Female is a gender, non-binary or an X denotes the absence of gender, therefore that's no more acceptable as a marker than leaving a blank space!""
Lambda Legal is a very conservative group?

> Potentially complicating matters for the federal government is a pending lawsuit filed by Dana Zzyym, a U.S. Navy veteran and intersex person.
>
>Since 2014, Zzyym has been trying to obtain a U.S. passport for use traveling overseas, but the State Department has repeatedly rejected Zzyym’s application for an “intersex” passport.
>
> The department permits individuals who transition from one gender to another to amend their passport to reflect their sex, but does not recognize an individual who is born with both male and female characteristics. 

If the US executive branch fucking with one of us trying to not put M or F on an official document over the span of both major parties' presidential administrations, isn't significant...

ETA: Not sure of the case status, now.
R-i-g-h-t....because your paranoia always trumps the actual experience of persons who have been using their ""X"" gender DL for the past year, flying many times, without the slightest hint of negativity from TSA agents.  

Paranoia much?  Thank you for the morning chuckle, though.  The fact that you think pointing out the lie of a right wing conservative rag in this forum is ""interrupting"" the right wing conservative rag is peculiar, to say the least.  The fact that you think every lawyer employed by the government is a right wing extremist bent on destroying human rights is just beyond the pale--I'm not sure if you take that position out of honest ignorance, or just hateful prejudice.
The lambda legal piece says that the x marker is not a problem for the real ID act and that state bills that allow it are specifically designed to comply with the act. The vast majority of news pieces regarding this report the same thing, including Fox News. 

Judicial watch is just speculating and scaremongering that this isn’t the case, and yes they are a far right group. 

Even if x markers were one day ruled non-compliant, that would be an action against the state not an individual and states would rectify it, not leave people in limbo and unable to drive/travel. 

Also, you could use a passport with m/f marker on it for travel (including domestic) if you are concerned about illegal action by TSA agents and use an x marker license for everything else.
2/2

R-i-g-h-t....because your feigned omniscience always trumps the actual experience of persons who have ever & will ever use our ""X"" gender DLs & wouldn't necessarily want their cases out of the closet. 

/block user
1/2 

""The fact that you think every lawyer employed by the government is a right wing extremist""

Not a fact, but thanks for the afternoon chuckle at another straw man.
Where are you pulling that from!? What Lambda Legal ""piece""? Their court document? No such rock-hard certainty or phrasing in anything I've read or word-searched. 

**ETA: You know what? Nevermind, don't answer me. You believe WTF it is you want to believe. Ignore the rest of my reply, I'm disabling inbox replies & not wasting any more time.**

No mention of Real ID in https://transgenderlawcenter.org/resources/id/ca-sb179

> TSA assistant press secretary Michelle Negron acknowledged policies allowing residents to list a gender other than male or female are “relatively new.” 

> “We’re working to develop guidance,” she told Fox News.

break

> Oregon officials are confident those who choose not to identify their gender will not have problems flying.

> “At this point, we don't expect any travel issues, but this is new territory for the whole country,” said David House, Oregon DMV spokesman.

break

> D.C. Councilmember Brianne K. Nadeau consulted with the National Center for Transgender Equality when drafting her bill, with the express purpose of ensuring compliance with REAL ID.

TSA was still working to develop guidance, so WTF does Oregon.gov get its confidence from? NCTE's not a federal government agency, so how can D.C. justify that they have compliance on lock?

States would have to sue the federal government on behalf of their citizens but there's no guarantee they'd rectify it. And the citizens would be left in limbo until temporary restraining orders or preliminary injunctions are issued, stays pending appeal are lifted, if at all. Courts move at a glacial pace; justice delayed is justice denied. Non-refundable tickets & airlines not willing to make exceptions for TSA-denied NBs? You can try claiming them as damages...

The whole point of me bringing this up is because we shouldn't have to hold US passports, let alone any primary/secondary identification with the wrong gender marker, to pass any kind of federal screening. It would be consistent for any fed to say the same type of fuckery against Zzyym's US passport applies to state DLs/IDs.

Any argument that international non-M/F passports pass muster is inapposite, as the US has no jurisdiction over foreign state departments & those countries would love if the US briar-patched over bigotry.

Related: https://twitter.com/danniaskini/status/1012835342183874560"	8vs502	NonBinary	31	0.98	2018-07-03 13:20:12
Bill Cipher Cosplay		Mostly good but missing the head that never stops screaming. I'll volunteer if you can't find one. 💜	ayiwgx	NonBinary	28	0.97	2019-03-07 22:54:09
People are constantly trying to invalidate me at my job...	"Hello folks just to start I am 36 amab nonbinary and have been on HRT since september of 2016...I currently work  in a call center and have been there for a year (it suck but is pays the  bills).   I primarily present still in androgynous dress and such as womens jeans tees  nothing live overtly feminine but  definitely not mens dress.   My mannerisms are probably still kind of male leaning and I  have been trying to bring out my softer side here recently.  Since day one at this place gay men have started  there whisper campaign against me because I don't act flaming like most of them do, we are all different.  They are like that ""that is a man"" that is  not a girl blah blah blah.    I basically get treated like a fraud at my job because I do not conform to some  stereotype of what a trans person is non binary is still trans.  The main thing that bothers me is people that dont know me trying to take my indentity away from me.  That burns  me up getting the side eye from people who don't know me. "	"There will be a day when you leave work and that will be the last time in your life you see their faces. You won't know it on that day, but a week later, a month later, a year later, you'll realize they're gone from your life. You can not change their negativity all by yourself, but you hopefully can create and influence positivity around you to fill the space as they leave. 

Until they fly the fuck away, kill them with kindness. Meet their side eye with a smile. Meet their whispers with genuine conversation. Be the incredible person you are meant to be, and let them stew in their hate or embrace a dialogue of acceptance.

<3 I am sorry you are in this position. We don't know you, but you have a hell of a lot of people here who care.
First, I am sorry you are going through this. I have found that people still have a hard time thinking outside the gender binary. It may be they just don't understand.

Have you tried talking to them? I realize that is emotional labor you may not want to spend. But, if you think they are genuinely just confused, it might help. I try to think of people as good before coming to other more nefarious conclusions. I have found if you give most people a genuine chance, they rise to the occasion. Mostly.

Alternately, you can talk to HR.

Best of luck no matter what you decide to do."	9q8jro	NonBinary	29	0.99	2018-10-22 00:06:42
I decided to pick up a pair of cosmetic frames on a whim ~ (Inspired by Bill Hader in It: Chapter 2)		They look good on you!	d8eu2y	NonBinary	25	0.93	2019-09-23 23:31:57
D.C. Council unanimously passes bill allowing non-binary gender markers on IDs		"> makes permanent a policy approved by the Bowser administration last year           

Our Queen is looking out for us."	9ihm9v	NonBinary	25	0.95	2018-09-24 12:47:30
How I Find Myself Coming Out... Again: an Elder Enby Story.	"CW - mention of illness, some derogatory terminology (historical reference)
-
-
-
-
-
-
-
-
-
-
-

Not a long rant, but I’m so frustrated right now. I just told my sister and nieces that I was planning a name change and I like they/them pronouns and I’m all butterflies now. Young people take note: this isn’t always a one time process. 

Sometime in the late 80s I realized I was “gay” but I still liked girls too. “Gay” was pretty much the only word, unless I went on stage in drag and then I was a “tranny.”  

By 1992 we had “gay, lesbian, and bi” and the LGB movement. So I was now bi. I came out as such to my closest friends. 

In 1995 I got married to a pretty masc woman. We’re still married, she’s the most supportive thing, cis (heavily closeted nbi but I’m not here to force people’s evolution) and we little 5’6 things are raising a 6’3 monster together. Yesterday was his 16th birthday. I was still bi. 

In 2000 I started a new career and moved. In 2005 when my son was born I came out as “bi” to the new people I worked with. I’m a film tech, so it cost me some work and some acquaintances, but it was worth it. 

I have always worn funky clothes and dressed a little unconventionally (dead giveaway). Sometime around 2012 or 2013 I started adding little “cosplay” touches. A leather pouch, fingerless gloves, etc. 

Im 2017 I go on the Keto diet and lose almost 100 lbs. I need new clothes. Out of my love of sixties fashion I order two pairs of women’s stretch bellbottoms from Wish. They fit great but they are a little thin (and tiny pockets goddamn it amirite?) Still as a “bi” I go to Marks because I need something underneath to keep me warm. Oh, what’s this? “Buttery soft leggings?”

Buttery soft. Those two words change everything. I go to Old Navy, take a deep breath, and cross to the women’s section. It’s all so COLOURFUL! And INTERESTING! And so so so soft. Still justifying it as “a hippie look” (I probably should have just clued in here) it’s soft, comfy cardigans, blanket scarves, oh look at me I’m just a hipster pfft... 

In 2019 I get the news. I have a terminal illness. I’ve got years, but not decades unless I’m lucky. So now I start thinking about what I want to do with my remaining time.  

Bringing us to now, where I have ditched a lot of toxic people from my life and now I’m trying to get out of my 70 hour work week business and find something where I can use my experiences to help other struggling LGBTQ people find peace and acceptance. I just need to figure out how to pay my bills with it! 

Oh. I guess it was a long rant. Anyway thanks for coming to my Ted Talk."	"Thank you for sharing! It’s inspiring to hear how you found yourself. Much love ❤️
Really inspiring and wish you nothing but the best ❤"	mf78ur	NonBinary	26	1.0	2021-03-28 18:54:09
A message to all UK enbies!	"In just under 3 months, on November 13th 2020, the 'Non-gender-specific Passports Bill 2019-21' will go to the house of commons for its second reading and will be up for debate. NB gender identities currently have no meaningful legal recognition in our country and this is our chance to make our voices heard and demand that our politicians recognise the validity of our existence. 

Although the bill specifically refers to our ability to identify our gender on passports, this marks an important step in the overall legal recognition of non-binary gender identities as a whole. It is therefore of vital importance that we all contact our local MPs and request them to support this bill at this stage and to support the legal recognition of our identity in overall political discourse. 

As part of this, it is our responsibility to educate our representatives on what it actually means to be non-binary and how this is distinct from those who are gender-nonconforming, binary-transgender or transsexual. Included below are links to some documents that I believe could be helpful for us to provide a baseline understanding of what it means to be non-binary and why it is important for us to gain the legal recognition we deserve. These are by no means all-encompassing or singly authoritative so please share any more resources you come across in the comments below. 

&#x200B;

WPATH Standards of Care  
[https://www.wpath.org/media/cms/Documents/SOC%20v7/Standards%20of%20Care\_V7%20Full%20Book\_English.pdf](https://www.wpath.org/media/cms/Documents/SOC%20v7/Standards%20of%20Care_V7%20Full%20Book_English.pdf)

&#x200B;

Non-binary Myth Busting, The Equality Recognition Campaign

[http://equalrecognition.scot/wp-content/uploads/Non-Binary-Myth-Busting.pdf](http://equalrecognition.scot/wp-content/uploads/Non-Binary-Myth-Busting.pdf)"	"It's late right now, but thanks for posting this, I'll save it and look at it tomorrow. I've just moved so I'm not sure who my MP is but I'll make sure to email them about it
thank you!!! i’ll be amazed if my mp responds as he’s absolutely useless but it’s worth a shot ☺️"	ide2nr	NonBinary	23	1.0	2020-08-20 16:56:12
