Title	Body	Comments	Post ID	Subreddit	Score	Upvote ratio	Date
Nervous to tell my parents I want top surgery	"So I'm nonbinary, and have identified that way for about 8/9 years and as generally not-cis for about 15 years. I'm about to inherit a considerable amount of money from my grandmother who died a few years ago, which my parents want me to invest. I agree with them, totally. And I'm going to give some money to my friends and pay some bills and invest most of it. But I also want to use some of that money to get top surgery. And, like, I'm an adult. I'm almost 30, but I'm still nervous about telling them that. They are generally accepting of my nonbinary-ness, but they don't \*get\* it. And since I haven't brought up or talked about top surgery to them for about 10 years (I'd put it out of my mind as something I'd never ever be able to afford), they're probably going to react with ""But you haven't mentioned it! Why now? Why are you thinking about this? Are you sure? Blah blah blah."" But I feel like this is a chance I have to use this money to do something that I've wanted for 15 years, and if I don't I feel like I'm going to regret not doing it. I mean, my parents wouldn't DO anything to me or whatever, they're somewhat supportive, I just feel like I'm going to have to defend myself to them and ""because I want to"" maybe won't be good enough. I was on the phone with my mother earlier tonight for another reason and I wanted to bring it up but I just couldn't. It's so stupid. They live 3 states away and I rarely see them and I could just go and do it and then be like ""surprise I got my titties gone"" but instead I'm nervous about telling them because I think they're going to ask me to explain myself and my explanation won't be enough to make them get it. But since I realized that getting top surgery was suddenly an option that was back on the table I've been watching every youtube video I can get my hands on of various ftm and nonbinary top surgery reveals/vlogs/information/etc and it just seems like the right thing to do. I'm just nervous that because I don't talk to my parents about my gender identity and haven't bound in years and generally just don't communicate much about that part of my life to them, they're going to question my motives and stuff like that. But top surgery is something that keeps popping up in my life and man, do I want it."	"Honestly - maybe the ""surprise, no titties!"" option might be the best for you in this case! I mean, you really don't HAVE to explain yourself to them, you're a grown ass adult! And you know that it's something you want. Are you looking for their approval before you do it? Are you looking for their advice? If they flew off the handle and said ""oh my god, absolutely not, we can't have you doing that, that's terrible!"" would it stop your desire to do it?
I think you have to ask yourself why do you feel the need to tell them about getting top surgery. You’re right. It’s your money, you’re a adult. Even if You don’t invest it and blow it all, you still don’t have to tell them what you did with it (please invest or put away into savings). 

You can get it done then at the next family function you can explain it to everyone at once. They may have questions, but I think your family just want you to be happy.
Just do it and don't tell them. That's my plan."	csveks	NonBinary	14	0.84	2019-08-20 09:08:54
New bill proposed in CT on requiring state agency forms and options to include nonbinary option. Really not all that much but at least it’s a start		It's nice that even in the midst of all this hatred and bigotry, there are still measures being proposed and taken to promote equality. I believe NJ added a gender-neutral birth certificate option a few days ago. It's not a replacement for full equality, but it's something.	amtwf8	NonBinary	14	0.95	2019-02-03 20:54:16
Dating experience -	"Okay so for all my NB folks here..I am NB but am AFAB. My dating preferences are still heterosexual men, but I’ve been told I’m too “masculine” when it comes to men?? I’m wondering if there’s anyone else that aligns with me situation?

Most of my dates lately have been us going out to dinner and either splitting the bill or me offering to pay. It seems like men get turned off by this? I’ve always been taught to bring my own money in case of situations where end up paying?

My whole dating experience has been weird because people see my dating app photos and think I’m magically femme in person?? It’s just a weird situation."	"If they get upset by a small thing like sharing the bill you probably have dodged a bullet anyway-  


Still, Good luck on finding someone !
I avoid dating straight men since I realized they often perceive me as just a girl and project their gender roles onto me. If my masculinity changes anything for them it's that they think I'll be down to dom them.
I'm curious why your partner's sexuality is important? I get that it can feel like it's reflecting on you, but why not, for example, bi men?

I get the frustration of them still seeing your agab and acting along those gender norms though. Very shitty to have to deal with.
I don't date straight men, straight women,  wlw,  mlm, Because most of the time I find that they won't accept you're gender and say that it's embarrassing or something
Thank you✨ I didn’t know if it’s just a people I’m meeting situation or if anyone NB is going through this as well🥲
This happened to me on my first date today and I guess it's bc I look really femme too but I've come to realize just now that it's a significant reason why I feel so uncomfortable and weird and kinda grossed out atm....he was treating me in a really forced gentlemanly way, it made me feel hyper feminine...the gender roles were very thick in the air lmao. It was enough to be uncomfortable even for cis women probs, but it felt like being fake the whole time🤢 


I didn't notice how much I was faking things till now, and it's draining, so I would vm recommend to not gloss over your identity as a non-binary person to try to people please on a date
I’ve liked bi men, but usually heterosexual men I match with. Sexuality doesn’t matter to me as far as that goes, I should have worded that better my bad.
In my experience people assume that you are gender binary unless you express that you're not.. And sometimes continue to act like it even after. So yeah, you're not alone in this case
I date anyone except cishet men for a similar reason. You may want to narrow your search to only bi men and/or AMAB nb - you will get fewer possibilities but you will likely have better experiences.
Yeah, I don’t really know a specific place to find exclusively bi men. Kinda sucks."	109ylle	NonBinary	12	0.94	2023-01-12 12:34:31
What do y'all do for a living?	Jobs? Careers? What pays the bills? I'm asking because my mother told me one of her fears, when I came out to her, is that nonbinary people seemed unprofessional and I wouldn't get a job, at least not one that requires a college degree, or other certifications. Do people over look you because of gender/presentation?	"I have a B.S. and an M.S. and currently have a full-time salaried position working for the US Forest Service. Your mom has a valid fear since many people do discriminate against nonbinary people (and trans people in general). I have experienced discrimination and uncomfortable/unwelcoming professional environments, but I feel strongly that this myth of all nonbinary people just being confused dysfunctional teenagers who need to snap out of it to have successful lives needs to end. We can and do live happy and productive adult lives.
I'm a graduate teacher of English as a second/foreign language. I teach teenagers, but mostly adults. Follow the career path you like, and look for jobs with employers who understand your identity doesn't affect your performance as a professional.
I work as a carpenter apprentice. The construction field is mainly men, so there was already discrimination before I was out (AFAB). But my current job is the first one I've been out at, and I've actually been treated more equally here than any other construction / manual labor job I've had. Doesn't hurt that it's a union job, so I have extra back-up in my corner against discrimination.

BTW, I do have a college degree, but I decided I prefer an active, hands-on job over a desk job. I'm not here because I couldn't get anything ""better"".
I work from home for a health insurance company by day and I'm a filthy DoorDash whore by night.
I’m a wine buyer/sommelier. My spouse (also enby) is an art director for a global fashion brand.
I have a Master’s degree and work as a cancer biology researcher. I’m not personally out at work, but generally speaking, the field is pretty queer-friendly and if I was a more confident person I would feel pretty safe being open about my identity.
I'm a web developer.
I'm a secondary school teacher with three degrees, currently managing an outdoor education centre. I'm out at work and have been for a long time. 

Education in my country does tend to be fairly progressive, but I've also learned that I would rather miss out on jobs that I would be miserable at, rather than hiding myself to fit in with other people.
Parks and Rec. I've been a naturalist and rec educator for 25 years.
I’m an engineer in the US, but I’m not very out at work. It’s a very conservative field.
I’m a transportation planner at a shared mobility non profit. I have a Master of Urban and Regional
Planning. Out of the 25 or so people in my org, about 90% of us are some flavor of queer, trans, gay, etc. it’s quite lovely but now I feel like I can never leave because I know I’ll likely never find it again.  I do find that it’s easier to work as an out non binary person living in a large Metro area with a pretty progressive mindset.
Im a financial analyst.  Buuuuut I'm not out at work yet and idk how that's going to go.  Might have to yeeet myself outta there once the dysphoria gets unbearable.
I teach at a community college
I’m a college history professor with a PhD. Doctor and Professor are gender neutral titles!
I work as a program coordinator at a university. My career is going well.
I have a Ph.D. and work as a Materials Scientist for a large international company.
Video producer.  
Unless you are presenting as a drug addiction or something I don't think yr appearance should affect yr job.
I'm a Quality Control Analyst in critical natural gas infrastructure focusing on leak survey and reporting, as well as patrol management. I've been with the company for 7 years, have come out to a few people in management, and still receive respect. In fact, it was the supervisors in my company that allowed me to feel comfortable with coming out because they added their pronouns to their email signatures even though they're cis. Do what you love and love who you are. There are no limits.
I'm a lab tech/instructional assistant for a community college. Openly queer and polyam. For the most part my experiences have been positive. I do have a colleague who is just a miserable (misogynistic, homophobic, transphobic, bigoted) human being (who I, unfortunately, have to work directly with) but my Dean and the rest of my division are absolutely lovely (and jump to my defense if needed).
2 professional non binary artists that your mum can Google are Shakti Kroopkin and Nayland Blake.
And I'm in event production, I've worked for and with newspapers as a writer and specialist, I'm an educator, and a performance and visual artist. Also co-progenitor of a drag house that produces events, education, music and new media art. I consider myself a Professional Julian.
We don't really have a job but we're trying to build a career in music, mostly using vocal synthetizers like UTAU, DeepVocal and will likely end up buying Vocaloid mobile in the near future. I personally like to use androgynous voicebanks like Namine Ritsu, Aino Erufu and plan on getting Vflower once we get Vocaloid mobile. - flower(fictive alter in sour patch kids system)
I worked as a park ranger's assistant for a while, and now I'm a receptionist.  That's what a literature degree gets you, lol.  But also there are so many nonbinary people in academia that the suggestion you ""can't get a job that requires a college degree"" is laughable to me.
EMT, going to school for nursing. But to be fair, I get misgendered almost 100% of the time by my coworkers and patients with the small exception of a couple partners who know & respect me as an enby.
currently work part time at a thrift store and also a bakery. was asked my pronouns during the interviews or the intake for both jobs (may not have been professional courtesy, i have a gender presentation and fashion sense that sounds the trans alarms in most cis peoples heads lol) and the managers and most staff use them correctly. previously was an assistant manager at a fast food chain and actually had a fair bit of the upper management using my pronouns correctly. i refuse to educate people i work with about transness/pronouns if im not getting paid for it so i never actually brought it up at that last job. some people just noticed my pronouns in my email signature and took it upon themselves to start using them (what a weirdly decent and humane thing to do, imagine that). no college degree but i got offered store manager/salaried position at that last job so careers wise it was an option.
I'm a graphic designer, and I've never had an issue regarding my appearance/presentation (I'm AFAB and switch back and forth between masc/fem presenting, including binding sometimes). That being said, I've never put my pronouns on a resume/job application or formally come out at work, so there's that.
 I’m a career coach. I literally help other people *get* jobs.
currently working part time as a server at a local restaurant, still in school closing in on my diploma, and im learning music theory/guitar along with photography and editing in my free time.

some weeks i dont have time for all of it, and thats okay. as long as i have an income when i need it and im enjoying what i do, then i say thats success.

edit: also, i didnt include my gender identity when applying for my first job because i was scared it might be an issue, but i take that back. if it is an issue for them, fuck em, they dont deserve your awesomeness anyways.
Registered nurse. My workplace is pretty blase about gender thankfully : )
I’m a software engineer. I use they/them pronouns at work, and have somehow ended up in the trans awareness committee. That said, my gender presentation is very cis, and I work from home. I believe things would be different if I worked in-office and didn’t present as a Dad.
I have a bachelor's degree in political science (plans to go to graduate school one day). But currently I work as a barista. Have worked at various nonprofits in the past as well.
Accountant at a university. I would receive greater discrimination if I worked in the corporate/private sector. 

If I denied who I was and pretended to be cis I would be terribly unhappy. So there are many professional opportunities but you just might have to modify where you choose work to avoid a toxic and cruel environment.  However, if you deny who you are and pretend to be cis it will probably lead to significant mental strain for mental illness over time.
I'm a lawyer in working in-house for a large tech company. Granted I came out in the middle of my career -- but I'm still here and I'm supported by my company. Yes there is discrimination and I come across people who don't ""get"" gender neutral pronouns -- but corporate culture (especially in tech) is evolving faster than a lot of sectors.
I have a postgrad degree in ecology and was an ecologist in the past, but am currently working in an unrelated industry in a 'it pays the bills' situation. I enjoy it though and my workplace is pretty inclusive so I think I'm ultimately happier than I was in my 'professional' job haha.

Although I don't think your mum's fears are totally unfounded (there is lgbt+ discrimination after all), I don't think I've ever come away from a job rejection where I felt my gender or presentation has been **the** reason I was rejected (things like my inability to relocate, lack of transport in the past, and applying for competitive positions have been).

I have no idea what field you're interested in, but maybe show your mum something like [ISBNS](https://isnbs.org)? Plenty of non-binary professionals. :)
Right now I work as an in store shopper but I’m studying to become an electrical engineer. Unfortunately, like another commenter in this thread said, I’m in the US so it’s still a pretty conservative field.
I own a small video game and hobbyist store.board games, anime, video games, pokemon and MTG, etc.
I'm the lead lab technician testing samples for local clinics in my area. I'm also starting a masters program to become a licensed therapist to help support trans people during their transition.
Executive Assistant at a small non-profit advocates for foster kids throughout the life of their case. My title sounds fancier than it is. I'm essentially the office manager and pa for our director.
Software engineer. I'm not out at work (I only started coming out about 4 months ago) and I work from home mostly. But I always carry my water bottle covered in enby and queer stickers when I do go into the office and I'm fairly certain a couple people have noticed.
I am currently a full time student, studying Game Development.
Government worker. Our workplace is amazing and accpteting.
I'm a lawyer, writer, and a professional public speaker.
Master degree in computer science, work as a software engineer ✌️ out as gay but not as nb
A lot of accomplished people in the comments! Love to see it! I myself have a B.S in studio art and currently work for a water restoration company as an admin/graphic designer 

Although...... I'm not very professional lol. I sit in an empty office most of the time I don't need to be"	11lk21t	NonBinary	12	1.0	2023-03-08 02:50:52
"Texas bill proposes criminal charges for performing drag at all-age venues & would change the definition of ""drag"" as literally anyone not performing as their AGAB"		"Well, that's fucking horrifying. Some ""land of the free"" we have here, eh?
Both Florida and Texas seem to be competing for shittiest state."	yxtftl	NonBinary	12	0.94	2022-11-17 15:40:57
How do you deal with being visibly queer?	"Hi all,

So I’m a femboy/transperson 5 months into my transition. Back when I was presenting as a straight-passing gay guy, I could go about my day without worrying what others thought of me. Now that I’m visibly queer, I feel a lot more exposed whenever I’m out in public.

Today, I went for a quick coffee run, and I got stuck at a crosswalk with a guy walking his dog. I noticed he noticed me, but I didn’t really pay him much attention, because I’ve been trying really hard to not care about how other people might react to me. As soon as the light turned green, I started walking and made it to other side before him (I’m a fast walker, lol). That’s when I heard him chuckle. I didn’t see a phone in his hand, so I don’t think he was laughing at a meme or anything. I think he was probably laughing at my backside, since my butt and waist are a little too curvy for a cisguy now.

Anyway, I got my coffee and went about my day. However, I can’t stop thinking about this incident. It’s not that I care what this guy thinks. It’s just that being visibly queer is such a new experience to me, I’m not sure how to deal with these kind of situations yet.

How do you guys do it? Do you guys just learn to live with the stares? My mentality so far has been *”these bitches ain’t paying my bills, so I should pay them no mind!”* and *“okay, but did I die??! no, I didn’t. I’m fine.”*"	"Ok so YMMV but I spent my formative years hanging out with (and being) absolute weirdos. I got so used to strangers barking at us because my girlfriend was wearing a costume tail that nothing phases me anymore. I don't even notice what strangers are doing around me unless they're directly addressing me. And sometimes not even then.
Made me think of the ""gays walk fast"" memes, could be that's what he was laughing about
I own it. I don't currently have coloured hair because covid (and I'm aiming for a viking braid look which I don't think I want to do with bleaching), but I used to have a short coloured mohawk, and I still have a denim jacket covered in pins, many of which are pride based. I have rainbow plugs in my ears, my t-shirts are often pride themed, and I often wear colourful patterned leggings to finish it all off.

So if someone laughs at me, y'know, big deal. I'm wearing armour.
Honestly, that last one is the one I use the most for survival. But there's also a similar option of ""what's the big deal to them anyway? I'm just being me, any problems they have are in their own head."" And from that I can lean into it to actually enjoy it or I can pull back to relax a bit
Devil's advocate: he could have been chuckling in surprised enjoyment of how curvy your backside looked.  I know I've checked people out from one side or the other covertly and then been startled into a quick giggle if they turn and the other side is just as attractive.  Maybe try to focus on the idea, ""That's right, check my ass out!  I worked hard to make my body how I like it and you should enjoy it!""
I try to ignore them. Or go as many places as possible with other people. Or wear headphones. After getting threatened a few times, sometimes unprompted and sometimes after I told them off, I don’t say anything back. I moved, though so aside from a couple times being told I’m in the wrong restroom people are chill. 🤷

Edit: I found it very hard to deal with the constant stares and intermittent harassment where I was. I am super fortunate to have been able to leave.
When I was young and an egg, I was always outed and bullied for being the weird one. It hurt! Though my family is full of weirdos, so they told me it was good to be weird. I never understood until recently! I realized how much I love to see people out in the world, just killing it, wearing whatever they want! I love seeing people be extra as hell! So now I strive to be like them, wear whatever the i want and rock it. I dream that one day, someone will see me and think, ""they're so cool, I wish I had that confidence!"" and hopefully it'll click with them too :) I never did anything to get bullied before, might as well ignore it and be happy instead. End rant. Good luck!!
I completely understand, for me most of the time I usually forget how I'm dressed and just accept it as a part of me but other times I'll realise how bright and flashy I look and want to curl into a ball when I realize people are looking. My suggestion? Say ""fuck it, this is me, this is always going to be me."" You don't owe anyone a toned down version of yourself, do what you love! Own it!
Honestly I’ve been through so much that I just don’t give a shit
that's so bad ass!!

You see, I did the opposite, lol. I spent my formative years avoiding the weirdos, because in my head, the worst thing you could be was weird. Little did I know, you guys had it right all along. You guys are the ones that give the least fucks about other people's opinion and are happier because of it! I hope to one day live my life as unbothered as you do!
Lol, I walk fast, because my father instilled it in me. He absolutely hates slow walkers. Growing up, he would give me and my brothers shit for walking slow, and now it's physically impossible for me to walk slower than 25 mph, 15 mph near a school zone.
That meme is so funny and had no idea that was a universal gay thing hahahahahaaha i always drive very fast and reckless which i hear is common too lmao
Ah, I remember being outside in fairly crowed areas weaving between people like I was trying to run from the cops but not make it too obvious... Now I hardly go out.
This was my first thought honestly, like damn ok! you just walkin around out here with all that cake??
I'm sorry to hear that you were threatened. If you don't mind me asking, where were you living and where did you move to? I live in LA, so queer people are super common here and being openly homophobic/transphobic is a big no-no.
One day you too will be awarded a costume tail, and on that day the legend will be passed on anew
I used to live in rural Michigan but now I live in Philadelphia.

Also the shock of being mildly street harassed wears off. I’m afab and started transitioning like 2 years ago so I was used to being harassed as a woman. Being constantly stared at though was what got me. I love being aggressively ignored now. The east coast aloofness is fine in that regard. Lol"	lz9mbj	NonBinary	12	1.0	2021-03-06 19:52:54
