Title	Body	Comments	Post ID	Subreddit	Score	Upvote ratio	Date
shaved my head again and realized i look like bill watterson (author of calvin & hobbes) and honestly i vibe with it		"Oh my god I've never seen a picture of him. I'm proud of you both.
At first I thought this was a before and after of you shaving your mustache.
Bill Watterson, can't you hear me?
Bill Watterson, please don't fear me.
Don't be shy, add a 'stash :)
I was scrolling and after a few photos of ppl transitioning I saw this and thought ""wow what a transition looks 20 years younger this is awesome!""

Then read the title and felt like a f* idiot. It has been a long day...😔
*That's* what the creator of Calvin and Hobbes looks like? Not at all what I expected lol. Also, you rock the look better than him, ngl.
My immediate response to this in my head was: ""nah Bill Watterson ain't got nothin on you!""

And while that remains true, the longer I look, the cuter he gets...
*bill watterson by lemon demon starts playing in the background*
I support this. Total look goals.
such a vibe. u look rly cool !! couldn't help but think of lemon demon tho lol
I was scrolling thru and scrolled too fast and thought this is a ""before and after shaving moustache"" (no offence, I thought it was nice!) but then I backed back isjxiaka
You look great btw!! 🥺
Obsessed with your glasses! You look 👌🏻
Thought this was somehow a before and after and I was like?? What the FUCK lol but you look great! Love your style
Pulling. It. Off.
Amazing :D
Nice look. My favorite is the one without the stash.
you are so cute! Also I love the aesthetic lol
I love Calvin and Hobbes and I love the look!
Such a good vibe!! I wish I looked like Bill Watterson 😓
lmaoo nice
You look gorgeous, it really suits you ☺️
I’ve always loved Calvin and Hobbes, but it’s kind of funny, both Bill Watterson and Charles Shultz were known to be reclusive assholes in real life.
As a huuuge Calvin and Hobbes fan, I fully support this
such a good look!! also wth i didnt know bill watterson was hot ?! new goals
I dig the vibe! That’s dope
Slap on a stache and you're ready to go homie
whoaaaa
suits you so well!!! 🌟🌟🌟🌟🌟
I literally wish I had his energy
Well now I love you both ❤
I am confused
Help
You look cute in both picture
Who are you?
How is your mustaches so bushy on one side and not the other
Edit: just read the caption 
Still don t know wich side you are
Still looking really good love your outfit/sweater
valid
Ughh I’ve been wanting to shave my head for so long this is making me want to do it more
Oh wow, I'd never seen what Bill Watterson looks like. Not at all what I expected, but very handsome, nonetheless, and that goes for you, too. ❤️
[deleted]
i guess i’ve been subconsciously digging his aesthetic the whole time, thank u
glad i'm not the only one
Don’t treat me like I have rabies.
I WAS WAITING FOR SOMEONE TO MENTION THAT
YES.
same 😂
good i have noticed 2 references in the comments by now
thank you :)
yes
lmao thanks!
Yeah I noticed that. He also has Calvin's mischievous grin.
Wayyyy cuter tho
I only wanna have your (babies)"	lqi257	NonBinary	2044	0.99	2021-02-23 13:09:49
Indeed so Bill Wurtz		"yeah! i always address people 'per person', like you can be 100% sure that the person you speak to/of is in fact a person (shocker ik)

funny thing is how terfs cry when u call them 'a person' like wdym, you're not a person? lol and they sometimes go with this dehumanizing phrase ""I'm not a person I'm a woman"" (???????) or ""you're erasing women!"", and I'm always like, ""no, it's okay i have no problem calling you a woman, just the first guess is to call u a person in case u happen to be enby""
""I'm a princess!""

*puberty later*

""Wait sorry, I read that wrong, I'm a **dunce**""
What about cat people, are they cool too?
Gneurshk
I'm just here to say that, today, a woman came into the female washroom (I'm afab so gotta use those) and, upon seeing me, she had to do a double-take on the door to make sure it was the right one. Gender euphoria!!!
Tell me why I read the last pic in Laszlo’s voice
I love this!
They r bein too goofy fr I think they need other things in their life to overthink instead
""When the doki of your heart, echoes the doki of the guns

There is a riot about to start when the catfolk come!""
You lucky human person"	10gptfu	NonBinary	1656	1.0	2023-01-20 06:38:06
teachers in florida fighting against the “don’t say gay” bill with malicious compliance ❤️		"What's the term? Malicious Compliance? Use their words against them. They were the ones who wanted to erase gender and sexuality : )
YES!!!!!!! THANK YOU 💜💜💜💜
I was just joking with a friend that they might do this, I didn't think it would happen, yes!
These kind of people who created this bill obviously forget being a cis boy or girl is still a gender identity, and being heterosexual is still a sexuality.
Ayyyyyyyyy👏🏻👏🏻👏🏻👏🏻👏🏻
Yessss
Or what I call the only kind of compliance.
Do they just not notice that they will probably not have any books left in the classrooms?
Hell yeah
Everyone gets to be like an Enby now! Yay! Definitely complies with their rules right? Haha.
Smells like false flag, what teacher would be dumb enough to direct concerns to ""your local congressperson"" (federal, who weren't involved & are power-separated) instead of legislators/senators/representatives (state, who were involved)?

Saying ""your student"" is false-flaggy too, as politically-active teachers tend to regard students as theirs, not yours.

*Only please, Brer Teacher, please don't throw me into the briar patch.*
Seriously teach about bugs ! And flowers! They are all over the place and it’s not about humans. Haha :P sneaks
These parents just pulled one of the best uno reverse cards on Florida! GG
I work with a Ftard that thinks teachers are grooming kids in Florida.......he's gonna take his AR and fix this......

The most dangerous people are conservative middle aged white single men with low incomes.......beware.
[removed]
Right! Because it’s easy to forget that fact when it’s forced on everyone all the time and becomes second nature for most to not question anything about it.
Moms4Liberty repost transmisic and bigoted tweets, such as Rowling.  
Their description is crypto-fascist.  
Sharing the letter seems like trying to fearmonger the conservatives/GQP/alt-right, but the letter content seems like good intentions and showing the ridiculousness of the bill.  
Even a sarcastic “gender neutral pronouns and honourifics” would be r/AccidentalAlly material.
Hey person we never said anything about fucking kids
Do you have any brain function left
LOL Forced......
Yeah its like. On one hand I could see them trying to fear monger reactions to the bill.

On the other hand, _could they even come up with this?_ And if so, why share it?

My personal theory is that the ""teacher in palm beach"" a) may or may not have been a teacher and b) is using the group to advertise the letter to try and get people to use it.

Hard for a random to share widely, but easy if it goes viral...
It absolutely is.
Conservative Equal rights: live & Let live. Unless you're gay.....or different.....

This effectively gives a gay parent the right to complain in Florida If a female teacher mentions her husband. I hope they get the shit sued out of them and your idiotic stance reveals to you How short-sighted your idealism is. I feel that you're playing tic-tac-toe not even checkers when you need to be playing chess sir. 

Did all this start when you accidentally watched RuPaul's drag race and you felt something move in your organs? Now you're trying to protect others from that funny feeling?"	tuxt0v	NonBinary	773	0.99	2022-04-03 01:40:49
